<?xml version="1.0" encoding="utf-8"?>
<p:event timestamp="2001-12-31T12:00:00" xmlns:p="http://video-metadata.tv.se/event/v1"
xmlns:p1="http://video-metadata.tv.se/common/v1"
xmlns:xsi="http://www.w3.org/2001/XMLSchema-instance"
xsi:schemaLocation="http://video-metadata.tv.se/event/v1 ../xsd/event.xsd">
  <p:id>p:id</p:id>
  <p:channelId>p:channelId</p:channelId>
  <p:descriptionList>
    <p:description language="EN">p:description</p:description>
  </p:descriptionList>
  <p:rerun>true</p:rerun>
  <p:live>true</p:live>
  <p:hidden>true</p:hidden>
  <p:groupId sequenceNumber="0">p:groupId</p:groupId>
  <p:timeList>
    <p:time type="public">
      <p:startTime>2001-12-31T12:00:00</p:startTime>
      <p:endTime>2001-12-31T12:00:00</p:endTime>
    </p:time>
  </p:timeList>
  <p:contentIdRef>p:contentIdRef</p:contentIdRef>
  <p:materialIdRef>p:materialIdRef</p:materialIdRef>
  <p:previousEventList>
    <p:event xsi:type="p:basicEventType">
      <p:id>p:id</p:id>
      <p:channelId>p:channelId</p:channelId>
      <p:rerun>true</p:rerun>
    </p:event>
  </p:previousEventList>
  <p:comingEventList>
    <p:event xsi:type="p:basicEventType">
      <p:id>p:id</p:id>
      <p:channelId>p:channelId</p:channelId>
      <p:rerun>true</p:rerun>
    </p:event>
  </p:comingEventList>
  <p:embeddedEventList>
    <p:event xsi:type="p:embeddedEventType">
      <p:id>p:id</p:id>
      <p:channelId>p:channelId</p:channelId>
      <p:rerun>true</p:rerun>
      <p:contentIdRef>p:contentIdRef</p:contentIdRef>
      <p:materialIdRef>p:materialIdRef</p:materialIdRef>
    </p:event>
  </p:embeddedEventList>
</p:event>
